{
  "schemaVersion": "1.0.0",
  "reviewedOn": "2026-10-30",
  "reviewBasis": "existing-public-portfolio",
  "projects": [
    {
      "id": "box-12",
      "title": "Quadruped Robot",
      "stage": "College",
      "category": "PERSONAL",
      "dateLabel": "Oct 2026 — Present",
      "location": "Collaborative Build",
      "summary": "A collaborative quadruped prototype developed through CAD revisions, printed parts, and assembly fit checks.",
      "completionState": "prototype-in-progress",
      "ownership": {
        "individual": [
          "Onshape modeling, assembly clearances, and print-efficient revisions.",
          "Recreated the initial body and head from Ethan’s SolidWorks dimensions."
        ],
        "team": [
          "Ethan provided the initial SolidWorks dimensions.",
          "The notebook records four legs attached and one leg actuated."
        ],
        "notClaimed": [
          "Sole authorship of the initial SolidWorks design.",
          "Walking, tracking, or complete physical folding validation.",
          "A rated payload or measured production cost savings."
        ]
      },
      "tools": [
        {
          "name": "Onshape",
          "usage": "Body and head recreation, mechanism packaging, and clearance revisions.",
          "owner": "individual",
          "evidenceIds": [
            "box-12-role"
          ]
        },
        {
          "name": "3D Printing",
          "usage": "Printed fit checks and a mirrored support reprint; printer operator is not identified.",
          "owner": "unclear",
          "evidenceIds": [
            "box-12-printing"
          ]
        }
      ],
      "claims": [
        {
          "id": "box-12-cad-revisions",
          "text": "Extended the chassis from 160 to 225 mm and shortened the upper leg link from 143 to 135 mm in CAD.",
          "owner": "individual",
          "state": "modeled",
          "evidenceIds": [
            "box-12-role",
            "box-12-body",
            "box-12-leg"
          ],
          "metrics": [
            {
              "value": 160,
              "unit": "mm",
              "meaning": "Initial body length",
              "conditions": "CAD dimension before revision."
            },
            {
              "value": 225,
              "unit": "mm",
              "meaning": "Revised body length",
              "conditions": "CAD dimension; not a performance result."
            },
            {
              "value": 143,
              "unit": "mm",
              "meaning": "Initial upper leg link length",
              "conditions": "CAD dimension before revision."
            },
            {
              "value": 135,
              "unit": "mm",
              "meaning": "Revised upper leg link length",
              "conditions": "CAD dimension; not a performance result."
            }
          ]
        },
        {
          "id": "box-12-assembly-progress",
          "text": "The collaborative build record documents four legs attached and one leg actuated.",
          "owner": "team",
          "state": "built",
          "evidenceIds": [
            "box-12-hardware"
          ],
          "metrics": [
            {
              "value": 4,
              "unit": "legs",
              "meaning": "Attached legs",
              "conditions": "Notebook record; does not establish walking."
            },
            {
              "value": 1,
              "unit": "leg",
              "meaning": "Actuated leg",
              "conditions": "Notebook record; full robot gait remains unverified."
            }
          ]
        },
        {
          "id": "box-12-folding-next",
          "text": "The CAD packages all four legs below the body; physical folding validation is next.",
          "owner": "unclear",
          "state": "planned",
          "evidenceIds": [
            "box-12-folding"
          ],
          "metrics": []
        }
      ],
      "evidence": [
        {
          "id": "box-12-role",
          "path": "src/content/projects/box-12.html",
          "quote": "My work focuses on Onshape modeling, assembly clearances, and print-efficient revisions. I recreated the initial body and head from teammate Ethan’s SolidWorks dimensions, then developed the changes shown here."
        },
        {
          "id": "box-12-body",
          "path": "src/content/projects/box-12.html",
          "quote": "Increased body length from 160 to 225 mm while simplifying the frame for continued prototyping."
        },
        {
          "id": "box-12-leg",
          "path": "src/content/projects/box-12.html",
          "quote": "Reduced the link from 143 to 135 mm so the legs fit without further lengthening the body."
        },
        {
          "id": "box-12-hardware",
          "path": "src/content/projects/box-12.html",
          "quote": "The notebook later records all four legs attached and one leg actuated."
        },
        {
          "id": "box-12-folding",
          "path": "src/content/projects/box-12.html",
          "quote": "Latest CAD configuration shows all four legs packaged below the body. Physical folding validation is next."
        },
        {
          "id": "box-12-printing",
          "path": "src/content/projects/box-12.html",
          "quote": "A right-hand support did not fit the left side. Mirroring and reprinting corrected the mismatch."
        }
      ],
      "limitations": [
        "Single-leg actuation does not establish a walking robot.",
        "All-leg folding is shown in CAD; physical folding validation remains next.",
        "Slicer estimates are estimates, and export dates are not design dates."
      ],
      "reviewNeeded": [
        "Confirm the division of assembly and actuation work between collaborators.",
        "Confirm progress after the October 2–11 notebook entries."
      ],
      "updatedOn": null
    },
    {
      "id": "box-7",
      "title": "Volumetric Display",
      "stage": "College",
      "category": "PERSONAL",
      "dateLabel": "Aug 2026 — Present",
      "location": "Collaborative Build",
      "summary": "Mechanical CAD and preliminary structural studies for a swept-volume display.",
      "completionState": "cad-and-preliminary-analysis",
      "ownership": {
        "individual": [],
        "team": [
          "Listed as a collaborative build; task ownership is not separated in the detailed record."
        ],
        "notClaimed": [
          "A functioning display, completed electronics, or physical spin testing.",
          "A verified safe rotational speed or measured drag reduction.",
          "Sole authorship of all CAD and analysis."
        ]
      },
      "tools": [
        {
          "name": "SolidWorks",
          "usage": "Named CAD tool in the project; individual operator is not identified.",
          "owner": "unclear",
          "evidenceIds": [
            "box-7-solidworks"
          ]
        },
        {
          "name": "Onshape",
          "usage": "Preliminary FEA studies; individual analyst is not identified.",
          "owner": "unclear",
          "evidenceIds": [
            "box-7-onshape",
            "box-7-arm",
            "box-7-shaft"
          ]
        }
      ],
      "claims": [
        {
          "id": "box-7-radial-supports",
          "text": "Replaced the broad rotating wall with twenty radial supports in the revised CAD model.",
          "owner": "unclear",
          "state": "modeled",
          "evidenceIds": [
            "box-7-rotor"
          ],
          "metrics": [
            {
              "value": 20,
              "unit": "supports",
              "meaning": "Revised radial support count",
              "conditions": "CAD configuration; not a completed display."
            }
          ]
        },
        {
          "id": "box-7-arm-analysis",
          "text": "A preliminary arm model reports about 23 psi peak stress under a 0.28 lbf modeled load.",
          "owner": "unclear",
          "state": "simulated",
          "evidenceIds": [
            "box-7-arm"
          ],
          "metrics": [
            {
              "value": 23,
              "unit": "psi",
              "meaning": "Approximate peak arm stress",
              "conditions": "Preliminary arm model with 0.28 lbf load and three support arms approximating the center constraint."
            },
            {
              "value": 0.28,
              "unit": "lbf",
              "meaning": "Modeled arm load",
              "conditions": "Analysis input; not a demonstrated load rating."
            }
          ]
        },
        {
          "id": "box-7-printable-shaft",
          "text": "Split the center shaft into printable sections for the Prusa Mini build envelope.",
          "owner": "unclear",
          "state": "modeled",
          "evidenceIds": [
            "box-7-printing"
          ],
          "metrics": []
        },
        {
          "id": "box-7-shaft-input",
          "text": "The shaft analysis notebook specifies approximately 4,500 degrees per second as a model input.",
          "owner": "unclear",
          "state": "simulated",
          "evidenceIds": [
            "box-7-shaft"
          ],
          "metrics": [
            {
              "value": 4500,
              "unit": "degrees/second",
              "meaning": "Specified shaft model rotational input",
              "conditions": "Not RPM, a physical test speed, or a validated safe operating speed."
            }
          ]
        }
      ],
      "evidence": [
        {
          "id": "box-7-rotor",
          "path": "src/content/projects/box-7.html",